[{"id":"ganesha","status":"draft","order":1,"name":{"sa":"गणेशः","iast":"gaṇeśaḥ","te":"గణేశః"},"name_common":{"te":"వినాయకుడు","hi":"गणेश जी","en":"Ganesha"},"also_known_as":[{"sa":"विनायकः","iast":"vināyakaḥ","te":"వినాయకః"},{"sa":"विघ्नेश्वरः","iast":"vighneśvaraḥ","te":"విఘ్నేశ్వరః"},{"sa":"गणपतिः","iast":"gaṇapatiḥ","te":"గణపతిః"},{"sa":"गजाननः","iast":"gajānanaḥ","te":"గజాననః"},{"sa":"एकदन्तः","iast":"ekadantaḥ","te":"ఏకదన్తః"},{"sa":"लम्बोदरः","iast":"lambodaraḥ","te":"లమ్బోదరః"}],"images":{"hero":"img.deity.ganesha.hero","card":"img.deity.ganesha.card"},"symbols":[{"image":"img.symbol.ganesha.modaka","label":"Modaka","meaning":{"te":"మోదకం అంటే ఆనందం. బయట సాదా, లోపల తీపి — జ్ఞానం కూడా అంతే.","hi":"मोदक यानी आनंद। बाहर से सादा, भीतर से मीठा — ज्ञान भी ऐसा ही है।","en":"Modaka means joy. Plain outside, sweet inside — like knowledge."}},{"image":"img.symbol.ganesha.mushika","label":"Mūṣaka","meaning":{"te":"చిన్న ఎలుక గొప్ప దేవుణ్ణి మోస్తుంది. చిన్నవాళ్ళకూ పెద్ద పని చేసే శక్తి ఉంది.","hi":"छोटा-सा चूहा महान देवता को उठाता है। छोटे में भी बड़ा काम करने की शक्ति है।","en":"A tiny mouse carries a great god. The small can do great things."}},{"image":"img.symbol.ganesha.ankusha","label":"Aṅkuśa","meaning":{"te":"అంకుశం మనసును సరైన దారిలో నడిపే గుర్తు.","hi":"अंकुश मन को सही राह पर ले चलने का प्रतीक है।","en":"The goad: gently guiding the mind onto the right path."}},{"image":"img.symbol.ganesha.pasha","label":"Pāśa","meaning":{"te":"పాశం మనల్ని దేవుని దగ్గరకు లాగే ప్రేమ బంధం.","hi":"पाश वह प्रेम-बंधन है जो हमें भगवान के पास खींच लाता है।","en":"The noose: the bond of love that draws us close to God."}},{"image":"img.symbol.ganesha.ekadanta","label":"Ekadanta","meaning":{"te":"విరిగిన దంతంతోనే మహాభారతం రాశాడు. జ్ఞానం కోసం ఇచ్చేది ఎప్పుడూ వృథా కాదు.","hi":"टूटे दाँत से ही उन्होंने महाभारत लिखा। ज्ञान के लिए दिया गया त्याग कभी व्यर्थ नहीं जाता।","en":"With his broken tusk he wrote the Mahabharata. What we give for knowledge is never lost."}},{"image":"img.symbol.ganesha.durva","label":"Dūrvā (garika)","meaning":{"te":"గరిక ఎక్కడైనా పెరుగుతుంది, ఎవరైనా సమర్పించవచ్చు. వినయానికి గుర్తు.","hi":"दूर्वा कहीं भी उग जाती है, कोई भी अर्पित कर सकता है। विनम्रता का प्रतीक।","en":"Durva grows anywhere and anyone can offer it. A sign of humility."}}],"intro":{"te":"వినాయకుడు విఘ్నాలను తొలగించే దేవుడు. ఏ పని మొదలుపెట్టినా, ఏ పూజ చేసినా మొదట ఆయననే తలచుకుంటాం. ఆయన పార్వతీ పరమేశ్వరుల కుమారుడు. ఏనుగు ముఖం, పెద్ద చెవులు, పెద్ద పొట్ట — అన్నీ వినడానికి, అన్నీ తనలో ఇముడ్చుకోవడానికి గుర్తులు. చిన్న ఎలుక ఆయన వాహనం. మోదకాలు, గరిక ఆయనకు ఇష్టం. బుద్ధికి, విద్యకు, శుభారంభానికి ఆయనే అధిపతి.","hi":"गणेश जी विघ्नों को दूर करने वाले देवता हैं। कोई भी काम या पूजा शुरू करने से पहले सबसे पहले उन्हीं का स्मरण किया जाता है। वे पार्वती और शिव के पुत्र हैं। हाथी का मुख, बड़े कान और बड़ा पेट — सब कुछ सुनने और सब कुछ अपने में समा लेने के प्रतीक हैं। छोटा-सा चूहा उनका वाहन है। मोदक और दूर्वा उन्हें प्रिय हैं। वे बुद्धि, विद्या और शुभ आरंभ के स्वामी हैं।","en":"Ganesha removes obstacles. Before any work or any puja begins, he is remembered first. He is the son of Parvati and Shiva. His elephant face, large ears and round belly remind us to listen to everything and hold everything with patience. A small mouse carries him. He loves modakas and durva grass. He is the lord of wisdom, learning and good beginnings."}}]